<?xml version="1.0" encoding="UTF-8"?>
<guia_telefonica xmlns:xsi="http://www.w3.org/2001/XMLSchema-instance" xsi:noNamespaceSchemaLocation="guia_telefonica.xsd">
<telefons>
    <nom>Raul</nom>
    <cognom>Masso</cognom>
    <telefon>+3468404256</telefon>
</telefons>
<telefons>
    <nom>Manuel</nom>
    <cognom>Masso</cognom>
    <telefon>+3468404256</telefon>
</telefons>
</guia_telefonica>